{
	"$schema": "https://json-schema.org/draft/2020-12/schema",
	"$id": "https://api.mainahq.com/link/v1/schemas/approval-ask.schema.json",
	"title": "ApprovalAsk",
	"description": "A pending ask the runtime routes to approvers, signed by the device: Ed25519 over utf8(\"maina-link/sig/v1\\napproval-ask\\n\") || JCS(ask without sig). Maina Link protocol v1. Generated from src/link/protocol/**; do not edit (adr/0008).",
	"type": "object",
	"additionalProperties": false,
	"required": [
		"v",
		"askId",
		"deviceId",
		"sentAt",
		"fallback",
		"dataClass",
		"data",
		"sig"
	],
	"properties": {
		"v": {
			"const": 1
		},
		"askId": {
			"type": "string",
			"pattern": "^[A-Za-z0-9][A-Za-z0-9_.:/-]{0,255}$",
			"examples": [
				"id_0001"
			]
		},
		"deviceId": {
			"type": "string",
			"pattern": "^[A-Za-z0-9][A-Za-z0-9_.:/-]{0,255}$",
			"examples": [
				"id_0001"
			]
		},
		"runId": {
			"type": "string",
			"pattern": "^[A-Za-z0-9][A-Za-z0-9_.:/-]{0,255}$",
			"examples": [
				"id_0001"
			]
		},
		"sentAt": {
			"type": "string",
			"pattern": "^[0-9]{4}-((0[13578]|1[02])-(0[1-9]|[12][0-9]|3[01])|(0[469]|11)-(0[1-9]|[12][0-9]|30)|02-(0[1-9]|1[0-9]|2[0-9]))T([01][0-9]|2[0-3]):[0-5][0-9]:[0-5][0-9]\\.[0-9]{3}Z$",
			"examples": [
				"2026-09-01T10:00:00.000Z"
			]
		},
		"fallback": {
			"type": "string",
			"enum": [
				"deny",
				"ask-local"
			]
		},
		"dataClass": {
			"type": "string",
			"enum": [
				"metadata",
				"names",
				"rich"
			]
		},
		"data": {
			"type": "object",
			"description": "The approval.requested event data at dataClass (`$defs`)."
		},
		"sig": {
			"type": "string",
			"pattern": "^[A-Za-z0-9_-]{85}[AQgw]$",
			"examples": [
				"AAAAAAAAAAAAAAAAAAAAAAAAAAAAAAAAAAAAAAAAAAAAAAAAAAAAAAAAAAAAAAAAAAAAAAAAAAAAAAAAAAAAAA"
			]
		}
	},
	"$defs": {
		"metadata": {
			"type": "object",
			"additionalProperties": false,
			"required": [
				"actionClass",
				"policyHash",
				"expiresAt"
			],
			"properties": {
				"actionClass": {
					"type": "string",
					"pattern": "^[a-z][a-z0-9_.-]{0,63}$",
					"examples": [
						"claude-code"
					]
				},
				"policyHash": {
					"type": "string",
					"pattern": "^sha256:[0-9a-f]{64}$",
					"examples": [
						"sha256:0000000000000000000000000000000000000000000000000000000000000000"
					]
				},
				"expiresAt": {
					"type": "string",
					"pattern": "^[0-9]{4}-((0[13578]|1[02])-(0[1-9]|[12][0-9]|3[01])|(0[469]|11)-(0[1-9]|[12][0-9]|30)|02-(0[1-9]|1[0-9]|2[0-9]))T([01][0-9]|2[0-3]):[0-5][0-9]:[0-5][0-9]\\.[0-9]{3}Z$",
					"examples": [
						"2026-09-01T10:00:00.000Z"
					]
				}
			}
		},
		"names": {
			"type": "object",
			"additionalProperties": false,
			"required": [
				"actionClass",
				"policyHash",
				"expiresAt"
			],
			"properties": {
				"actionClass": {
					"type": "string",
					"pattern": "^[a-z][a-z0-9_.-]{0,63}$",
					"examples": [
						"claude-code"
					]
				},
				"policyHash": {
					"type": "string",
					"pattern": "^sha256:[0-9a-f]{64}$",
					"examples": [
						"sha256:0000000000000000000000000000000000000000000000000000000000000000"
					]
				},
				"expiresAt": {
					"type": "string",
					"pattern": "^[0-9]{4}-((0[13578]|1[02])-(0[1-9]|[12][0-9]|3[01])|(0[469]|11)-(0[1-9]|[12][0-9]|30)|02-(0[1-9]|1[0-9]|2[0-9]))T([01][0-9]|2[0-3]):[0-5][0-9]:[0-5][0-9]\\.[0-9]{3}Z$",
					"examples": [
						"2026-09-01T10:00:00.000Z"
					]
				},
				"repoName": {
					"type": "string",
					"minLength": 1,
					"maxLength": 255,
					"examples": [
						"acme/payments"
					]
				},
				"branchName": {
					"type": "string",
					"minLength": 1,
					"maxLength": 255,
					"examples": [
						"feat/refunds"
					]
				}
			}
		},
		"rich": {
			"type": "object",
			"additionalProperties": false,
			"required": [
				"actionClass",
				"policyHash",
				"expiresAt"
			],
			"properties": {
				"actionClass": {
					"type": "string",
					"pattern": "^[a-z][a-z0-9_.-]{0,63}$",
					"examples": [
						"claude-code"
					]
				},
				"policyHash": {
					"type": "string",
					"pattern": "^sha256:[0-9a-f]{64}$",
					"examples": [
						"sha256:0000000000000000000000000000000000000000000000000000000000000000"
					]
				},
				"expiresAt": {
					"type": "string",
					"pattern": "^[0-9]{4}-((0[13578]|1[02])-(0[1-9]|[12][0-9]|3[01])|(0[469]|11)-(0[1-9]|[12][0-9]|30)|02-(0[1-9]|1[0-9]|2[0-9]))T([01][0-9]|2[0-3]):[0-5][0-9]:[0-5][0-9]\\.[0-9]{3}Z$",
					"examples": [
						"2026-09-01T10:00:00.000Z"
					]
				},
				"repoName": {
					"type": "string",
					"minLength": 1,
					"maxLength": 255,
					"examples": [
						"acme/payments"
					]
				},
				"branchName": {
					"type": "string",
					"minLength": 1,
					"maxLength": 255,
					"examples": [
						"feat/refunds"
					]
				},
				"command": {
					"type": "string",
					"minLength": 1,
					"maxLength": 8192,
					"examples": [
						"bun test src/billing"
					]
				},
				"path": {
					"type": "string",
					"minLength": 1,
					"maxLength": 4096,
					"examples": [
						"src/billing/refunds.ts"
					]
				},
				"diff": {
					"type": "string",
					"minLength": 1,
					"maxLength": 65536,
					"examples": [
						"--- a/src/x.ts\n+++ b/src/x.ts\n@@ -1 +1 @@\n-a\n+b\n"
					]
				}
			}
		}
	},
	"allOf": [
		{
			"if": {
				"properties": {
					"dataClass": {
						"const": "metadata"
					}
				},
				"required": [
					"dataClass"
				]
			},
			"then": {
				"properties": {
					"data": {
						"$ref": "#/$defs/metadata"
					}
				}
			}
		},
		{
			"if": {
				"properties": {
					"dataClass": {
						"const": "names"
					}
				},
				"required": [
					"dataClass"
				]
			},
			"then": {
				"properties": {
					"data": {
						"$ref": "#/$defs/names"
					}
				}
			}
		},
		{
			"if": {
				"properties": {
					"dataClass": {
						"const": "rich"
					}
				},
				"required": [
					"dataClass"
				]
			},
			"then": {
				"properties": {
					"data": {
						"$ref": "#/$defs/rich"
					}
				}
			}
		}
	]
}
