{
	"v": 1,
	"askId": "ask_01J9Z3P2",
	"deviceId": "dev_01J9Z3K4T8QX",
	"runId": "run_01J9Z3N2B6WQ",
	"sentAt": "2026-09-28T09:15:03.010Z",
	"fallback": "deny",
	"dataClass": "metadata",
	"data": {
		"actionClass": "git.push",
		"policyHash": "sha256:b2b2b2b2b2b2b2b2b2b2b2b2b2b2b2b2b2b2b2b2b2b2b2b2b2b2b2b2b2b2b2b2",
		"expiresAt": "2026-09-28T09:20:03.004Z"
	},
	"sig": "askxxxxxxxxxxxxxxxxxxxxxxxxxxxxxxxxxxxxxxxxxxxxxxxxxxxxxxxxxxxxxxxxxxxxxxxxxxxxxxxxxxA"
}
